{
  "operation_id": "00000000-0000-4000-8000-000000000001",
  "status": "complete",
  "truncated": false,
  "detector_versions": {
    "prompt_injection": "rules-v1",
    "jailbreak": "rules-v1",
    "secret": "rules-v1",
    "pii": "rules-v1"
  },
  "findings": [
    {
      "rule_id": "PII.EMAIL",
      "category": "pii",
      "severity": "medium",
      "segment_id": "message-0",
      "start_byte": 8,
      "end_byte": 26,
      "detector_version": "rules-v1"
    }
  ]
}
